{
  "tool_registry_version": "0.1.0",
  "tool_id": "utility.add.v1",
  "tool_version": "1.0.0",
  "domain": "utility",
  "function": {
    "name": "utility_add",
    "description": "İki sayıyı deterministik olarak toplar.",
    "parameters": {
      "type": "object",
      "properties": {
        "left": {"type": "number", "description": "İlk sayı."},
        "right": {"type": "number", "description": "İkinci sayı."}
      },
      "required": ["left", "right"],
      "additionalProperties": false
    }
  },
  "output_schema": {
    "type": "object",
    "properties": {"result": {"type": "number"}},
    "required": ["result"],
    "additionalProperties": false
  },
  "execution": {
    "default_type": "local_executable",
    "supported_types": ["local_executable", "mock"],
    "fixture_ids": ["utility.add.basic"],
    "resettable": false
  },
  "access": {
    "source": "project_demo",
    "url": null,
    "authentication": "not_applicable",
    "credential_env_vars": [],
    "license": null,
    "license_url": null,
    "terms_checked_on": null
  },
  "risks": {
    "safety": "low",
    "freshness": "static",
    "personal_data": false,
    "side_effects": false,
    "notes": "Yalnızca altyapı testi için gösterim aracıdır."
  },
  "lifecycle": "demo"
}

